url,name,address,city,state,phone
https://porterkinney.com/,"PorterKinney, PC","ÓÉą8109 W Grandridge Blvd Ste 110, Kennewick, WA 99336",Kennewick,WA,Óāį(509) 713-7300
http://www.accountsense.cpa/,Account Sense PLLC,,Albion,WA,Óāį(509) 591-0105
http://www.championtaxaccounting.com/,"Champion Tax & Accounting, Inc.","ÓÉą7501 W Enoch Rd, Clayton, WA 99110",Clayton,WA,Óāį(509) 300-0038
http://ckacpa.com/,Christensen King PC CPA's & Financial Advisers,"ÓÉą1334 Jadwin Ave, Richland, WA 99354",Richland,WA,Óāį(509) 943-1040
http://nwcpagroup.com/,Northwest CPA Group PLLC,"ÓÉą1333 Columbia Park Trail Ste 120, Richland, WA 99352",Richland,WA,Óāį(509) 735-1300
https://www.johnrmortoncpa.com/,"JOHN R. MORTON, CPA, PS","ÓÉą1950 Black Lake Blvd SW, Olympia, WA 98512",Olympia,WA,Óāį(360) 705-9795
http://www.leffelotiswarwick.com/,"Leffel, Otis & Warwick","ÓÉą513 6th St, Davenport, WA 99122",Davenport,WA,Óāį(509) 725-3251
https://alisanacpa.com/,Alisa Na CPA,"ÓÉą8319 238th St SW, Edmonds, WA 98026",Edmonds,WA,Óāį(425) 744-2742
https://alegriacpas.com/?utm_source=GMB&utm_medium=Website&utm_campaign=Button,"Alegria & Company, P.S.","ÓÉą210 Chardonnay Ave d, Prosser, WA 99350",Prosser,WA,Óāį(509) 575-1065
https://www.alliedaccountingofwa.com/,Allied Accounting,"ÓÉą1400 Talbot Rd S #210, Renton, WA 98055",Renton,WA,Óāį(425) 970-3876
https://www.shannon-cpas.com/,Shannon & Associates LLP,"ÓÉą1851 Central Pl S #225, Kent, WA 98030",Kent,WA,Óāį(253) 852-8500
https://www.claconnect.com/locations/washington/offices/cla-tricities-kennewick,CLA (CliftonLarsonAllen),"ÓÉą8101 W Grandridge Blvd #130, Kennewick, WA 99336",Kennewick,WA,Óāį(509) 735-1561
http://www.piersoncpapllc.com/,Pierson CPA PLLC,"ÓÉą201 W Francis Ave suite h, Spokane, WA 99205",Spokane,WA,Óāį(509) 465-0762
http://www.hmacpa.com/,"HMA CPA, PS","ÓÉą601 W 1st Ave Ste 1000, Spokane, WA 99201",Spokane,WA,Óāį(509) 455-8173
